date,event,description
1991-06-15,Mount Pinatubo Eruption,Global temperatures and CO? uptake affected after massive volcanic eruption
1997-05-01,Strong El Ni¤o Begins,Intensified climate effects and atmospheric CO? variability
1998-06-01,Strong El Ni¤o Ends,End of major El Ni¤o event
2009-12-18,Copenhagen Accord,Global climate policy milestone (UN COP15)
2015-12-12,Paris Agreement Signed,Landmark international agreement to limit global warming
2020-04-01,COVID-19 Lockdowns Begin,Temporary dip in global emissions during pandemic
